{
  "schemaVersion": "dungeon-v1",
  "resolverVersion": "v1",
  "id": "case-001-day-01",
  "title": "Побічна тривога у східному крилі",
  "stages": [
    {
      "number": 1,
      "role": "entry",
      "encounterType": "exploration",
      "scene": "Черговий викладач веде вас до зачиненого східного крила. З-під дверей тягнеться холодний туман, але пил біля правої стіни не зворушений.",
      "important": false,
      "clues": [{ "id": "s1-wall", "text": "Пил біля правої стіни не зворушений." }],
      "choices": [
        {
          "id": "s1-agility",
          "label": "Прослизнути вздовж чистої стіни",
          "kind": "check",
          "clueId": "s1-wall",
          "rationale": "Незворушений пил позначає безпечну лінію руху.",
          "stat": "agility",
          "tier": "easy",
          "tacticalModifier": "counter",
          "copy": {
            "success": "Ви входите, не зачепивши холодної завіси.",
            "neutral": "Ви входите обережно.",
            "failure": "Туман торкається вас і відбирає сили."
          }
        },
        {
          "id": "s1-vitality",
          "label": "Пройти крізь туман напряму",
          "kind": "check",
          "clueId": "s1-wall",
          "rationale": "Прямий шлях ігнорує підказку та перевіряє витривалість.",
          "stat": "vitality",
          "tier": "standard",
          "tacticalModifier": "standard",
          "copy": {
            "success": "Ви витримуєте крижаний опір.",
            "neutral": "Ви входите повільно.",
            "failure": "Холод пробирає до кісток."
          }
        },
        {
          "id": "s1-neutral",
          "label": "Почекати, поки туман розвіється",
          "kind": "neutral",
          "clueId": "s1-wall",
          "rationale": "Очікування гарантує прохід, але виснажує часом і холодом.",
          "copy": {
            "success": "Прохід відкрито.",
            "neutral": "Туман слабшає, і ви проходите далі.",
            "failure": "Очікування затягнулося."
          }
        }
      ]
    },
    {
      "number": 2,
      "role": "clue",
      "encounterType": "research",
      "scene": "У коридорі висять три навчальні печаті. Лише середня відкидає тінь проти світла, а на підлозі крейдою написано: «Відлуння бреше».",
      "important": false,
      "clues": [{ "id": "s2-shadow", "text": "Середня печать відкидає тінь проти світла." }],
      "choices": [
        {
          "id": "s2-magic",
          "label": "Розплести середню печать",
          "kind": "check",
          "clueId": "s2-shadow",
          "rationale": "Неприродна тінь викриває магічну підміну.",
          "stat": "magical",
          "tier": "easy",
          "tacticalModifier": "counter",
          "copy": {
            "success": "Фальшива печать гасне й відкриває прохід.",
            "neutral": "Печаті стихають.",
            "failure": "Відлуння закляття б'є у відповідь."
          }
        },
        {
          "id": "s2-agility",
          "label": "Швидко перетнути проміжок між печатями",
          "kind": "check",
          "clueId": "s2-shadow",
          "rationale": "Точний рух може оминути зону хибної печаті.",
          "stat": "agility",
          "tier": "standard",
          "tacticalModifier": "standard",
          "copy": {
            "success": "Ви проходите між імпульсами.",
            "neutral": "Ви минаєте печаті.",
            "failure": "Один імпульс наздоганяє вас."
          }
        },
        {
          "id": "s2-neutral",
          "label": "Заглушити всі печаті захисною тканиною",
          "kind": "neutral",
          "clueId": "s2-shadow",
          "rationale": "Повільний універсальний спосіб не вимагає перевірки.",
          "copy": {
            "success": "Коридор безпечний.",
            "neutral": "Ви витрачаєте час, але проходите.",
            "failure": "Тканина не втримала імпульс."
          }
        }
      ]
    },
    {
      "number": 3,
      "role": "application",
      "encounterType": "combat",
      "scene": "Зі стелі спускається глиняний сторож. Його праве плече вкрите свіжими тріщинами, а руни на грудях пульсують у повільному ритмі.",
      "important": false,
      "clues": [{ "id": "s3-crack", "text": "Праве плече сторожа вкрите свіжими тріщинами." }],
      "choices": [
        {
          "id": "s3-physical",
          "label": "Ударити в тріснуте плече",
          "kind": "check",
          "clueId": "s3-crack",
          "rationale": "Тріщина є фізичною слабкістю конструкта.",
          "stat": "physical",
          "tier": "standard",
          "tacticalModifier": "counter",
          "copy": {
            "success": "Плече розсипається, сторож падає.",
            "neutral": "Сторож відступає.",
            "failure": "Удар ковзає, і сторож відповідає."
          }
        },
        {
          "id": "s3-magical",
          "label": "Збити ритм рун імпульсом",
          "kind": "check",
          "clueId": "s3-crack",
          "rationale": "Руни керують пошкодженим тілом сторожа.",
          "stat": "magical",
          "tier": "standard",
          "tacticalModifier": "standard",
          "copy": {
            "success": "Ритм рун рветься, конструкція завмирає.",
            "neutral": "Руни слабшають.",
            "failure": "Руни відбивають нестійкий імпульс."
          }
        },
        {
          "id": "s3-neutral",
          "label": "Відступати, прикриваючись колоною",
          "kind": "neutral",
          "clueId": "s3-crack",
          "rationale": "Колона дає гарантований, але виснажливий обхід.",
          "copy": {
            "success": "Ви обходите сторожа.",
            "neutral": "Кілька ударів дістають вас, та шлях відкритий.",
            "failure": "Сторож затискає прохід."
          }
        }
      ]
    },
    {
      "number": 4,
      "role": "resistance",
      "encounterType": "hazard",
      "scene": "Сходи вкриті срібним пилом. На кожній третій сходинці пил лежить рівно, а збоку тремтить мотузка аварійного спуску.",
      "important": true,
      "clues": [{ "id": "s4-third", "text": "На кожній третій сходинці пил лежить рівно." }],
      "choices": [
        {
          "id": "s4-agility",
          "label": "Ступати лише на кожну третю сходинку",
          "kind": "check",
          "clueId": "s4-third",
          "rationale": "Рівний пил показує неактивні пластини.",
          "stat": "agility",
          "tier": "standard",
          "tacticalModifier": "counter",
          "copy": {
            "success": "Ви проходите між пластинами.",
            "neutral": "Сходи позаду.",
            "failure": "Одна пластина спрацьовує."
          }
        },
        {
          "id": "s4-vitality",
          "label": "Закритися плащем і бігти",
          "kind": "check",
          "clueId": "s4-third",
          "rationale": "Прямий ривок покладається на витривалість.",
          "stat": "vitality",
          "tier": "hard",
          "tacticalModifier": "standard",
          "copy": {
            "success": "Ви витримуєте град уламків.",
            "neutral": "Ви дістаєтеся низу.",
            "failure": "Уламки боляче б'ють крізь плащ."
          }
        },
        {
          "id": "s4-neutral",
          "label": "Спуститися аварійною мотузкою",
          "kind": "neutral",
          "clueId": "s4-third",
          "rationale": "Мотузка обходить пастку ціною виснаження.",
          "copy": {
            "success": "Ви спускаєтеся.",
            "neutral": "Мотузка ріже долоні, але витримує.",
            "failure": "Мотузка рветься."
          }
        },
        {
          "id": "s4-trap",
          "label": "Наступити на сходинку з порушеним пилом",
          "kind": "trap",
          "clueId": "s4-third",
          "rationale": "Порушений пил приховує активну пластину.",
          "copy": {
            "success": "Пластина мовчить.",
            "neutral": "Ви проходите.",
            "failure": "Пластина спрацьовує незалежно від сили."
          }
        }
      ]
    },
    {
      "number": 5,
      "role": "miniboss",
      "encounterType": "combat",
      "scene": "У залі чекає дзеркальний вартовий. Перед кожним ударом його ліва грань темніє, а права накопичує світло.",
      "important": false,
      "clues": [{ "id": "s5-dark", "text": "Перед ударом ліва грань вартового темніє." }],
      "choices": [
        {
          "id": "s5-magical",
          "label": "Розсіяти темну грань контрімпульсом",
          "kind": "check",
          "clueId": "s5-dark",
          "rationale": "Темна грань запускає атаку і вразлива до контрмагії.",
          "stat": "magical",
          "tier": "standard",
          "tacticalModifier": "counter",
          "copy": {
            "success": "Імпульс руйнує ритм вартового.",
            "neutral": "Вартовий спиняється.",
            "failure": "Контрімпульсу бракує сили."
          }
        },
        {
          "id": "s5-physical",
          "label": "Розбити світлу грань силовим ударом",
          "kind": "check",
          "clueId": "s5-dark",
          "rationale": "Силовий маршрут можливий, але не використовує точний телеграф.",
          "stat": "physical",
          "tier": "hard",
          "tacticalModifier": "standard",
          "copy": {
            "success": "Світла грань тріскається під ударом.",
            "neutral": "Вартовий хитається.",
            "failure": "Відбите світло обпалює вас."
          }
        },
        {
          "id": "s5-neutral",
          "label": "Перечекати серію за кам'яним щитом",
          "kind": "neutral",
          "clueId": "s5-dark",
          "rationale": "Щит гарантує прохід після виснажливої серії.",
          "copy": {
            "success": "Серія завершується.",
            "neutral": "Щит тріскається, але ви проходите.",
            "failure": "Щит не витримує."
          }
        }
      ]
    },
    {
      "number": 6,
      "role": "counterplay",
      "encounterType": "social",